{
  "schema_version": 1,
  "recommended_labels": [
    "run_id",
    "cluster",
    "job",
    "node",
    "gpu",
    "producer",
    "role",
    "worker_id",
    "local_rank",
    "phase",
    "device",
    "interface",
    "operation",
    "parallel_group",
    "rank",
    "replica",
    "runtime",
    "filesystem",
    "deployment",
    "status",
    "tool",
    "reported_key",
    "verl_stage",
    "policy_scope",
    "source",
    "boundary_scope",
    "state"
  ],
  "manifest_only_fields": [
    "git_commit",
    "container_image_digest",
    "dataset_uri",
    "checkpoint_uri",
    "rank_map",
    "profiler_options",
    "model_id",
    "precision",
    "global_batch_size",
    "sequence_length",
    "storage_path_type",
    "filesystem_path",
    "cache_state",
    "node_topology",
    "verl_config",
    "ray_address",
    "rl_insight_server_url",
    "native_metrics_endpoints",
    "artifact_root",
    "storage_topology"
  ],
  "metrics": [
    {
      "name": "training_async_sampleable_count",
      "category": "training",
      "unit": "samples",
      "scope": "run/worker",
      "source": "VERL separate_async/decision/sampleable_count",
      "policy": "reported replay-buffer samples eligible for the next trainer update; not engine queue"
    },
    {
      "name": "training_async_samples_remaining",
      "category": "training",
      "unit": "samples",
      "scope": "run/worker",
      "source": "VERL separate_async/decision/remaining",
      "policy": "reported next-step decision sample gap; not observed wait duration"
    },
    {
      "name": "training_async_should_switch_to_rollout",
      "category": "training",
      "unit": "boolean",
      "scope": "run/worker",
      "source": "VERL separate_async/decision/should_switch_to_rollout",
      "policy": "reported float 0/1 switch decision; not a completed lifecycle transition"
    },
    {
      "name": "training_async_effective_switch_cost_seconds",
      "category": "training",
      "unit": "seconds",
      "scope": "run/worker",
      "source": "VERL separate_async/decision/effective_switch_cost_seconds",
      "policy": "reported switch cost estimate, absent when unknown; not current step latency"
    },
    {
      "name": "training_tokens_per_second",
      "category": "training",
      "unit": "tokens/s",
      "scope": "run",
      "source": "framework adapter",
      "policy": "always"
    },
    {
      "name": "training_samples_per_second",
      "category": "training",
      "unit": "samples/s",
      "scope": "run",
      "source": "framework adapter",
      "policy": "always"
    },
    {
      "name": "training_step_time_seconds",
      "category": "training",
      "unit": "s",
      "scope": "rank",
      "source": "framework timer",
      "policy": "always"
    },
    {
      "name": "training_loss",
      "category": "training",
      "unit": "ratio",
      "scope": "step",
      "source": "framework adapter",
      "policy": "always"
    },
    {
      "name": "training_step",
      "category": "training",
      "unit": "step",
      "scope": "rank",
      "source": "framework adapter",
      "policy": "always"
    },
    {
      "name": "training_timer_seconds",
      "category": "training",
      "unit": "s",
      "scope": "rank",
      "source": "Megatron rank-local timer",
      "policy": "megatron"
    },
    {
      "name": "training_sample_timestamp_seconds",
      "category": "training",
      "unit": "s",
      "scope": "node",
      "source": "application-metrics textfile bridge",
      "policy": "always"
    },
    {
      "name": "training_model_flops_utilization_ratio",
      "category": "training",
      "unit": "ratio",
      "scope": "run and trainer-reported completed stage; actor, critic, and actor inference remain separate",
      "source": "VERL file logger perf/mfu/actor, perf/mfu/critic, or perf/mfu/actor_infer",
      "policy": "only explicitly reported finite ratios in [0, 1]; never derived from GPU utilization"
    },
    {
      "name": "training_data_wait_seconds",
      "category": "training",
      "unit": "s",
      "scope": "rank",
      "source": "framework timer",
      "policy": "always"
    },
    {
      "name": "training_compute_seconds",
      "category": "training",
      "unit": "s",
      "scope": "rank",
      "source": "framework timer",
      "policy": "always"
    },
    {
      "name": "training_communication_seconds",
      "category": "training",
      "unit": "s",
      "scope": "parallel group",
      "source": "framework timer or selected trace",
      "policy": "distributed"
    },
    {
      "name": "training_communication_overlap_ratio",
      "category": "training",
      "unit": "ratio",
      "scope": "parallel group",
      "source": "selected trace",
      "policy": "diagnostic"
    },
    {
      "name": "training_pipeline_bubble_ratio",
      "category": "training",
      "unit": "ratio",
      "scope": "pipeline stage",
      "source": "framework adapter or selected trace",
      "policy": "pipeline parallel"
    },
    {
      "name": "training_rank_straggler_ratio",
      "category": "training",
      "unit": "ratio",
      "scope": "rank",
      "source": "Megatron StragglerDetector or summary",
      "policy": "distributed"
    },
    {
      "name": "rollout_requests_queued",
      "category": "rollout",
      "unit": "requests",
      "scope": "replica",
      "source": "verl or inference engine metrics",
      "policy": "agentic rl"
    },
    {
      "name": "rollout_queue_age_seconds",
      "category": "rollout",
      "unit": "s",
      "scope": "replica",
      "source": "verl adapter",
      "policy": "agentic rl"
    },
    {
      "name": "rollout_requests_per_second",
      "category": "rollout",
      "unit": "requests/s",
      "scope": "role",
      "source": "verl or inference engine metrics",
      "policy": "agentic rl"
    },
    {
      "name": "rollout_output_tokens_per_second",
      "category": "rollout",
      "unit": "tokens/s",
      "scope": "role",
      "source": "verl or inference engine metrics",
      "policy": "agentic rl"
    },
    {
      "name": "rollout_time_to_first_token_seconds",
      "category": "rollout",
      "unit": "s",
      "scope": "request histogram",
      "source": "inference engine metrics",
      "policy": "agentic rl"
    },
    {
      "name": "rollout_time_per_output_token_seconds",
      "category": "rollout",
      "unit": "s/token",
      "scope": "request histogram",
      "source": "inference engine metrics",
      "policy": "agentic rl"
    },
    {
      "name": "rollout_kv_cache_utilization_ratio",
      "category": "rollout",
      "unit": "ratio",
      "scope": "replica",
      "source": "inference engine metrics",
      "policy": "agentic rl"
    },
    {
      "name": "rollout_preemptions_total",
      "category": "rollout",
      "unit": "events",
      "scope": "replica",
      "source": "inference engine metrics",
      "policy": "agentic rl"
    },
    {
      "name": "agent_turns",
      "category": "agent",
      "unit": "turns",
      "scope": "episode histogram",
      "source": "verl agent adapter",
      "policy": "agentic rl"
    },
    {
      "name": "agent_tool_call_duration_seconds",
      "category": "agent",
      "unit": "s",
      "scope": "tool histogram",
      "source": "OpenTelemetry or application metric",
      "policy": "agentic rl"
    },
    {
      "name": "agent_tool_call_errors_total",
      "category": "agent",
      "unit": "events",
      "scope": "tool",
      "source": "OpenTelemetry or application metric",
      "policy": "agentic rl"
    },
    {
      "name": "agent_tool_call_timeouts_total",
      "category": "agent",
      "unit": "events",
      "scope": "tool",
      "source": "OpenTelemetry or application metric",
      "policy": "agentic rl"
    },
    {
      "name": "agent_environment_wait_ratio",
      "category": "agent",
      "unit": "ratio",
      "scope": "run",
      "source": "OpenTelemetry summary",
      "policy": "agentic rl"
    },
    {
      "name": "sandbox_active",
      "category": "sandbox",
      "unit": "sandboxes",
      "scope": "worker",
      "source": "optional sandbox runtime adapter",
      "policy": "when available"
    },
    {
      "name": "sandbox_queued",
      "category": "sandbox",
      "unit": "sandboxes",
      "scope": "worker",
      "source": "optional sandbox runtime adapter",
      "policy": "when available"
    },
    {
      "name": "sandbox_create_duration_seconds",
      "category": "sandbox",
      "unit": "s",
      "scope": "operation",
      "source": "optional sandbox runtime adapter",
      "policy": "when available"
    },
    {
      "name": "sandbox_reset_duration_seconds",
      "category": "sandbox",
      "unit": "s",
      "scope": "operation",
      "source": "optional sandbox runtime adapter",
      "policy": "when available"
    },
    {
      "name": "sandbox_failures_total",
      "category": "sandbox",
      "unit": "events",
      "scope": "worker",
      "source": "optional sandbox runtime adapter",
      "policy": "when available"
    },
    {
      "name": "sandbox_io_read_bytes_total",
      "category": "sandbox",
      "unit": "bytes",
      "scope": "cgroup",
      "source": "cgroup v2 io.stat",
      "policy": "optional"
    },
    {
      "name": "sandbox_sample_timestamp_seconds",
      "category": "sandbox",
      "unit": "s",
      "scope": "cgroup",
      "source": "cgroup v2 sampler clock",
      "policy": "optional"
    },
    {
      "name": "sandbox_io_write_bytes_total",
      "category": "sandbox",
      "unit": "bytes",
      "scope": "cgroup",
      "source": "cgroup v2 io.stat",
      "policy": "optional"
    },
    {
      "name": "sandbox_io_read_ops_total",
      "category": "sandbox",
      "unit": "operations",
      "scope": "cgroup",
      "source": "cgroup v2 io.stat",
      "policy": "optional"
    },
    {